{"schema_version":"synth.task-contract.v1","task_id":"craftax.nanohorizon","family":"craftax","revision":"nh-08.1","runtime":{"image_digest":"sha256:1111111111111111111111111111111111111111111111111111111111111111","entrypoint":["python","-m","nanohorizon.eval"]},"datasets":[{"dataset_id":"craftax-seeds-v1","digest":"sha256:2222222222222222222222222222222222222222222222222222222222222222"}],"evaluator":{"evaluator_id":"nanohorizon-mac-v1","digest":"sha256:3333333333333333333333333333333333333333333333333333333333333333"},"seed_policy":{"kind":"explicit","seeds":[91004,91007,91009]},"capability_requirements":["tool_calls","mlx"],"metadata":{"display_name":"NanoHorizon — café 🌅"},"digest":"sha256:150ffef953d4fe4275f593c21a85a98d6e0b954a028afa8bfb85b02afe27c3e0"}
